tweet_id,content,posted_at,language,retweet_count,flag,user_id
5095,I bet Nick is gone and he just said the joke thing to keep us here like dummies ,Fri Apr 17 21:41:07 PDT 2009,English,88152,NO_QUERY,5095
5096,sleepy.. i guess i'll go to bed now.. log day of shopping! with no shopping for me  i'm saving money.. (trying to..),Fri Apr 17 21:41:14 PDT 2009,English,31487,NO_QUERY,5096
5097,I have a competition  I'm gonna look like crap,Fri Apr 17 21:41:16 PDT 2009,English,19153,NO_QUERY,5097
5098,@ivey Can't find them in my Rhapsody  Mayhap you can share sometime?,Fri Apr 17 21:41:16 PDT 2009,English,36164,NO_QUERY,5098
5099,": Budding Fibromyalgia Flare + Barn Cleaning + Stomach Issues + Alpaca Shearing = Full Blown Fibro Event, apparently. I can barely move. ",Fri Apr 17 21:41:17 PDT 2009,English,5612,NO_QUERY,5099
5100,"Getting excited with Ginger Garrett's newest book, 'In The Shadow of Lion'. But I don't think I can find it here ",Fri Apr 17 21:41:21 PDT 2009,English,76032,NO_QUERY,5100
5101,when am i gonna finally be not sick???? ,Fri Apr 17 21:41:22 PDT 2009,English,22296,NO_QUERY,5101
5102,"@superdaveyboy  Wish I could do something to help. Sorry you got the overnight shift. Yuck. (If you get bored, &quot;dc&quot; can play Go Fish! lol)",Fri Apr 17 21:41:25 PDT 2009,English,100854,NO_QUERY,5102
5103,"I feel like getting wasted right now, but I have nothing to drink  #wasted #drunk #plowed",Fri Apr 17 21:41:25 PDT 2009,English,69967,NO_QUERY,5103
5104,jus got a flat tire ,Fri Apr 17 21:41:29 PDT 2009,English,84189,NO_QUERY,5104
5105,"@montefontaine yeah I did, I was a slacker over the winter &amp; gained 15 of the 50 pounds I lost since starting to work out, so ashamed ",Fri Apr 17 21:41:31 PDT 2009,English,3279,NO_QUERY,5105
5106,@ndoto Woow! Shelby's gonna be crushed.  #hillhouse,Fri Apr 17 21:41:37 PDT 2009,English,26953,NO_QUERY,5106
5107,@Thepartyscene38 hm. sorry for never replying to you. ,Fri Apr 17 21:41:37 PDT 2009,English,65417,NO_QUERY,5107
5108,Why is it that when I'm really in the mood to rp everyone dies on me?  ,Fri Apr 17 21:41:42 PDT 2009,English,80088,NO_QUERY,5108
5109,"@ModelMandyLynn I spent all day doing yard work too, ripping up stumps took me over 3 hours ",Fri Apr 17 21:41:46 PDT 2009,English,117027,NO_QUERY,5109
5110,@MrsJonKnight i...wish ,Fri Apr 17 21:41:48 PDT 2009,English,51444,NO_QUERY,5110
5111,@jagelzey omg i want to see her...i didn't know they put the tour dates out yet....tix are kinda expensive though ,Fri Apr 17 21:41:51 PDT 2009,English,49804,NO_QUERY,5111
5112,At work w/ a headache thats sitting behind my eyes so looking at this computer screen isn't helping any&gt;&gt;&gt; ,Fri Apr 17 21:41:52 PDT 2009,English,108773,NO_QUERY,5112
5113,the hardest decision.. what album will i take off my itouch cause i have no memory left  yay for 800 updates! haha,Fri Apr 17 21:41:54 PDT 2009,English,98050,NO_QUERY,5113
5114,@manpreets7 iPhone uninsured unlocked ,Fri Apr 17 21:41:58 PDT 2009,English,63698,NO_QUERY,5114
5115,@nicholasbraun n you didnt answer my question yet ,Fri Apr 17 21:42:00 PDT 2009,English,44677,NO_QUERY,5115
5116,same shitt different day ... when does it stop .. ,Fri Apr 17 21:42:02 PDT 2009,English,55177,NO_QUERY,5116
5117,Jake is spending the night at Nicks bc we*re going out of town tomorrow and all I want to do is cry  I miss him......goodnight,Fri Apr 17 21:42:04 PDT 2009,English,14979,NO_QUERY,5117
5118,This sucks ,Fri Apr 17 21:42:04 PDT 2009,English,13273,NO_QUERY,5118
5119,Is off to sleep - hopefully.  Thanks for the company nat xx,Fri Apr 17 21:42:05 PDT 2009,English,40266,NO_QUERY,5119
5120,"@roobylou i dunno at this point, im sorry  lol",Fri Apr 17 21:42:06 PDT 2009,English,83858,NO_QUERY,5120
5121,ive bin rate limited on twitterific ,Fri Apr 17 21:42:08 PDT 2009,English,67552,NO_QUERY,5121
5122,absolutely adoring my son!! He's growing up too fast though ,Fri Apr 17 21:42:09 PDT 2009,English,4793,NO_QUERY,5122
5123,ipod is 100% completely dead... been charging for 15 minutes and it still says the battery is too low ,Fri Apr 17 21:42:10 PDT 2009,English,57665,NO_QUERY,5123
5124,@AroundHarlem working ,Fri Apr 17 21:42:12 PDT 2009,English,55333,NO_QUERY,5124
5125,So tired of looking for wholesale beads and not finding what I want! ,Fri Apr 17 21:42:13 PDT 2009,English,100177,NO_QUERY,5125
5126, no luck no one has responed yet I don't think anyone crossed their fingers for me lol come on people this is a team effort lol,Fri Apr 17 21:42:15 PDT 2009,English,30415,NO_QUERY,5126
5127,"Power tripped at CLV again, internet was out from about 8pm-9am this morning, feels pretty bad when we get the abused for it thou ",Fri Apr 17 21:42:21 PDT 2009,English,26541,NO_QUERY,5127
5128,i want it to be sunday right now ,Fri Apr 17 21:42:24 PDT 2009,English,88069,NO_QUERY,5128
5129,Just woke up and as soon as I was about to start getting ready to party.. its raining ,Fri Apr 17 21:42:30 PDT 2009,English,16477,NO_QUERY,5129
5130,I just bawled my eyes out watching Marley and me. ,Fri Apr 17 21:42:31 PDT 2009,English,38558,NO_QUERY,5130
5131,"@mcwneks  I hope I am not too late, but protect your son!  Circ is not necessary &amp; harms babies ",Fri Apr 17 21:42:38 PDT 2009,English,4702,NO_QUERY,5131
5132,Retail therapy is over *sigh*. Now time for the housework. ,Fri Apr 17 21:42:41 PDT 2009,English,46252,NO_QUERY,5132
5133,@Spongebob  Why waste such a great username? Give it to meh plz?,Fri Apr 17 21:42:42 PDT 2009,English,121165,NO_QUERY,5133
5134,"As a kid, I chased my cat with a spray bottle  , LOL #randomfacts",Fri Apr 17 21:42:42 PDT 2009,English,119279,NO_QUERY,5134
5135,Don't tell the women about the Mycocepurus smithii... bad day for male ants everywhere ,Fri Apr 17 21:42:43 PDT 2009,English,79193,NO_QUERY,5135
5136,http://twitpic.com/3i793 - The face of defeat ,Fri Apr 17 21:45:04 PDT 2009,English,7837,NO_QUERY,5136
5137,"Is off to bed, got to be up in 5 hours ",Fri Apr 17 21:45:12 PDT 2009,English,12160,NO_QUERY,5137
5138,@McCainBlogette wouldn't you rather be at home? ,Fri Apr 17 21:45:12 PDT 2009,English,37650,NO_QUERY,5138
5139,its okay I don't mind. I dont ...no way. but I do ,Fri Apr 17 21:45:17 PDT 2009,English,121879,NO_QUERY,5139
5140,"Writing a new song on the fire escape enjoying Captain on the rocks, mmmmm, so delicous, playoff hockey is over for the night ",Fri Apr 17 21:45:25 PDT 2009,English,65037,NO_QUERY,5140
5141,@HejlHavok oh no!  It became Undone. ,Fri Apr 17 21:45:25 PDT 2009,English,31901,NO_QUERY,5141
5142,@Jassonc i cant believe you saw 17 again w/o me! ,Fri Apr 17 21:45:25 PDT 2009,English,72374,NO_QUERY,5142
5143,I feel bad  Amy was stretched out sleeping but I had to kick her out the room for the night,Fri Apr 17 21:45:32 PDT 2009,English,30401,NO_QUERY,5143
5144,@thegaydreamer I missed it  do you know if there's a link to watch? and thanks!,Fri Apr 17 21:45:34 PDT 2009,English,36334,NO_QUERY,5144
5145,@brookandthecity Cant wait I miss yal soo much ,Fri Apr 17 21:45:35 PDT 2009,English,50712,NO_QUERY,5145
5146,work work work work work work ,Fri Apr 17 21:45:42 PDT 2009,English,56949,NO_QUERY,5146
5147,@devinthedude007  dang i always miss your show ,Fri Apr 17 21:45:42 PDT 2009,English,65271,NO_QUERY,5147
5148,@ddurgadas the waterfront is still chilly ,Fri Apr 17 21:45:47 PDT 2009,English,48347,NO_QUERY,5148
5149,@Woth2982 ohhhh no. I was clearing out my dvr as well and I fell asleep for a few hours. I have to work in the morning. ,Fri Apr 17 21:45:48 PDT 2009,English,3172,NO_QUERY,5149
5150,just watched marley and me...such a sad movie! ,Fri Apr 17 21:45:49 PDT 2009,English,36401,NO_QUERY,5150
5151,will be going to dentist later in the day for braces check-up ,Fri Apr 17 21:45:51 PDT 2009,English,62785,NO_QUERY,5151
5152,Well... It seems like I do in fact grind/bite on my teeth too hard at night. First night without Valium and its worse again. ,Fri Apr 17 21:45:56 PDT 2009,English,116769,NO_QUERY,5152
5153,"damn, we are signed up for the banjo &amp; fiddle competition and our fiddle player cant make it! ",Fri Apr 17 21:45:57 PDT 2009,English,53636,NO_QUERY,5153
5154,"looking for friends, im new to this twitter ",Fri Apr 17 21:45:59 PDT 2009,English,92080,NO_QUERY,5154
5155,"@heygorgeous Awwwwwwww, that sucks   Lemme give you a &quot;twitter hug&quot;; Hopefully, this will make you feel better.",Fri Apr 17 21:46:07 PDT 2009,English,82905,NO_QUERY,5155
5156,@Killandra holy crap u ok? U sound really sick ,Fri Apr 17 21:46:11 PDT 2009,English,679,NO_QUERY,5156
5157,I ate lunch outside for no more then 30 minutes today. And I'm pink. Stupid burnable skin. ,Fri Apr 17 21:46:16 PDT 2009,English,23799,NO_QUERY,5157
5158,Gahh I need a job!!! I want a new guitar...like now ,Fri Apr 17 21:46:18 PDT 2009,English,75776,NO_QUERY,5158
5159,I don't want to care but I do...so I say I don't then I die ,Fri Apr 17 21:46:19 PDT 2009,English,11187,NO_QUERY,5159
5160,canucks won! sweet! it's a friday night and i'm ready for bed. i'm super lame.  nite nite.,Fri Apr 17 21:46:20 PDT 2009,English,29599,NO_QUERY,5160
5161,Just found out our free Saturday isn't so free anymore.   sleeping in till 8am SCORE! haha,Fri Apr 17 21:46:21 PDT 2009,English,125498,NO_QUERY,5161
5162,had his calf lock on him again! ,Fri Apr 17 21:46:22 PDT 2009,English,20833,NO_QUERY,5162
5163,@tabatha_akers  I feel so bad for you!!! love you honey and get well!!!,Fri Apr 17 21:46:22 PDT 2009,English,96075,NO_QUERY,5163
5164,@Chren1213 bitch!!! im so jealous!! im hungry right now too. ugh. u couldve at least taken a pic of them for me  ,Fri Apr 17 21:46:24 PDT 2009,English,79983,NO_QUERY,5164
5165,No dollhouse tonight.   I'm cheering myself up with ANTM and pretzels with hummus.,Fri Apr 17 21:46:28 PDT 2009,English,12318,NO_QUERY,5165
5166,@woverton I've had it for a couple days  hope it's only about 24 hours!,Fri Apr 17 21:46:28 PDT 2009,English,44652,NO_QUERY,5166
5167,@brierockstarxo Awww I'm not going out tonight  I was too tired.. I'm hanging out at a girlfriends house,Fri Apr 17 21:46:29 PDT 2009,English,31002,NO_QUERY,5167
5168,bed time. work early tomorrowww ,Fri Apr 17 21:46:30 PDT 2009,English,36641,NO_QUERY,5168
5169,will be going to dentist later in the day for braces readjustment ,Fri Apr 17 21:46:32 PDT 2009,English,93085,NO_QUERY,5169
5170,"@jessicarendall Aw, sorry to hear  Hope they're ok!",Fri Apr 17 21:46:34 PDT 2009,English,49468,NO_QUERY,5170
5171,@bhartling http://twitpic.com/3i6vu - Forgot to add my Ewwww ,Fri Apr 17 21:46:35 PDT 2009,English,53609,NO_QUERY,5171
5172,"Apparently the laundry room burst in flames... but now it's all cleared up. Still smells like smoke though, even on the top floor. ",Fri Apr 17 21:46:35 PDT 2009,English,118922,NO_QUERY,5172
5173,"@Robinae24 yeah its 05:45 here and am still awake and not even in work, it seems the USA comes out to play about now ",Fri Apr 17 21:46:42 PDT 2009,English,91034,NO_QUERY,5173
5174,"@taylorswift13 it's about prom time again, isn't it? ahhh I miss it.  I should go and try dresses on haha.",Fri Apr 17 21:46:42 PDT 2009,English,31916,NO_QUERY,5174
5175,@OfficialAshleyG Heath Ledger. R.I.P ,Fri Apr 17 21:46:42 PDT 2009,English,125120,NO_QUERY,5175
5176, not looking forward to my 10 hour shift tomorrow.,Fri Apr 17 21:46:45 PDT 2009,English,7273,NO_QUERY,5176
5177,old people talking about dopers who steal anything thats not bolted down...i never want to be old ,Fri Apr 17 21:46:45 PDT 2009,English,117395,NO_QUERY,5177
5178,No! The bb thing is starting  so sad. I think i am going to die :x,Fri Apr 17 21:46:50 PDT 2009,English,117800,NO_QUERY,5178
5179,was watching larry king live and our cable went out booohoooo ,Fri Apr 17 21:46:50 PDT 2009,English,106342,NO_QUERY,5179
5180,@MorgansDead true...  i usually dont take summer classes....but i have a week or two to rest up before Field School *cheers*,Fri Apr 17 21:46:51 PDT 2009,English,25731,NO_QUERY,5180
5181,I accidentally locked Myrtle in the bedroom all day - I fear there may be cat piss somewhere in here now ,Fri Apr 17 21:46:53 PDT 2009,English,15950,NO_QUERY,5181
5182,managed to wake up early today @8..feeling sleepy again.. ,Fri Apr 17 21:46:58 PDT 2009,English,80264,NO_QUERY,5182
5183,@myhaloromance *double sigh* sad day  and Johnny Depp is old too (( SADFACE!,Fri Apr 17 21:47:02 PDT 2009,English,37611,NO_QUERY,5183
5184,"im lonely  keep me company! 22 female, Ithaca - New York",Fri Apr 17 21:47:04 PDT 2009,English,58359,NO_QUERY,5184
5185,My uncle passed today ,Fri Apr 17 21:47:04 PDT 2009,English,51142,NO_QUERY,5185
5186,@kammoye sorry to hear that homie  wut up?,Fri Apr 17 21:47:06 PDT 2009,English,59315,NO_QUERY,5186
5187,"some of the people on the show The Cougar are younger than me,  am i old? lol,",Fri Apr 17 21:47:07 PDT 2009,English,94143,NO_QUERY,5187
5188,Yet another day -- working thru a weekend sucks ,Fri Apr 17 21:47:08 PDT 2009,English,114434,NO_QUERY,5188
5189,Is up for the day... Bummer of a day so far... ,Fri Apr 17 21:47:08 PDT 2009,English,117697,NO_QUERY,5189
5190,"@iTalal exactlly , that what happend to me    inshallah i will change that SOON",Fri Apr 17 21:47:08 PDT 2009,English,51259,NO_QUERY,5190
5191,watching Family Matters... Steve always says the saddest things... ,Fri Apr 17 21:47:14 PDT 2009,English,95891,NO_QUERY,5191
5192,Hello to all of my new followers! I'm Ashley &amp; here is a random fact about me: I've never seen the entire E.T. movie. He terrifies me. ,Fri Apr 17 21:47:14 PDT 2009,English,32860,NO_QUERY,5192
5193,just smashed his big toe into the stairs and it really hurts now. And I mean really hurts. I'll have to see how it is in the morning ,Fri Apr 17 21:47:18 PDT 2009,English,33807,NO_QUERY,5193
5194,"@nick_carter Yeah, I agree with YeleysaBsb and ladycarolina, we appreciated (REALLY) but it seemed a bit harsh ",Fri Apr 17 21:47:24 PDT 2009,English,111547,NO_QUERY,5194
5195,"Ahhh, celebrating success this week. Found new suppliers for must-have items.  Old suppliers just quit supplying!  ",Fri Apr 17 21:47:29 PDT 2009,English,83505,NO_QUERY,5195
5196,@MCRmuffin: thanks I always need to talk ,Fri Apr 17 21:47:29 PDT 2009,English,52649,NO_QUERY,5196
5197,Finally reached ann's school. Crazy. Photoshoot got canceled. How to shoot when only 2 host are present? ,Fri Apr 17 21:47:33 PDT 2009,English,47629,NO_QUERY,5197
5198,still sad. didnt get to see 17 again today ,Fri Apr 17 21:47:38 PDT 2009,English,112081,NO_QUERY,5198
5199,"aww, ellie fears the wicked bad thunderstorm!  sad, but cute.",Fri Apr 17 21:47:37 PDT 2009,English,45966,NO_QUERY,5199
5200,is taking a break from reading BIO!  ,Fri Apr 17 21:47:39 PDT 2009,English,106732,NO_QUERY,5200
5201,wait. it is my understanding that stuff is going down and i was not invited. as usual. WHY. AM I BORING OR SOMETHING? ,Fri Apr 17 21:47:41 PDT 2009,English,17884,NO_QUERY,5201
5202,Salmon is only good in nigiri sushi. What a disgusting way to find out. ,Fri Apr 17 21:47:43 PDT 2009,English,46363,NO_QUERY,5202
5203,"My former Edu/Phil prof, teacher of Critical Thinking has 2ndary liver cancer: announced her Reiki Master quals. I want to shoot myself. ",Fri Apr 17 21:50:12 PDT 2009,English,27178,NO_QUERY,5203
5204,"is very, VERY tired  . . .yet, still looking forward to spending my saturday with mumsy!! ",Fri Apr 17 21:50:14 PDT 2009,English,120072,NO_QUERY,5204
5205,@fushujing Yes! I am beginning to like it here man! And the friends I have made are amazing. Seriously. We are all going home soon. ,Fri Apr 17 21:50:13 PDT 2009,English,16607,NO_QUERY,5205
5206,@rebelchicnyc I HAVE NO MORE YOGI TEA!!!!!   girl I done lost my mind out there!!  I have a solution tho I'll get right back on track,Fri Apr 17 21:50:17 PDT 2009,English,19272,NO_QUERY,5206
5207,"@SparksKincade it's good, Ken. Sorry, I still don't really get this whole twitter thing and didn't know you responded to me ",Fri Apr 17 21:50:20 PDT 2009,English,106603,NO_QUERY,5207
5208,Just had half of my medical tests done today for going to China. . ... Not a fun experience. ,Fri Apr 17 21:50:26 PDT 2009,English,122437,NO_QUERY,5208
5209,"CANUCKS 2-0 SERIES, THE &quot;BLUES&quot; ARE FEELING THE BLUE  HAHAHAHA!!!!",Fri Apr 17 21:50:31 PDT 2009,English,60815,NO_QUERY,5209
5210,"@Hennartonline I am not kidding  they use your ID and slide it on the register, the ID check is automatic, but we cant get the vote right",Fri Apr 17 21:50:34 PDT 2009,English,54545,NO_QUERY,5210
5211,Alone  The silence and the dark make a bad combination. Eeek. Helpp.,Fri Apr 17 21:50:35 PDT 2009,English,101559,NO_QUERY,5211
5212,youtube is down.. i feel like something is missing from my possession ,Fri Apr 17 21:50:36 PDT 2009,English,125915,NO_QUERY,5212
5213,I hate this live feed. They need a Texas C-SPAN. ,Fri Apr 17 21:50:36 PDT 2009,English,37532,NO_QUERY,5213
5214,Just woke up.. It's 12:49pm here in the Philippines! SO HOT! I'm sweating as hell! ,Fri Apr 17 21:50:46 PDT 2009,English,92380,NO_QUERY,5214
5215,us girls always know. Unfortunatly.  ,Fri Apr 17 21:50:46 PDT 2009,English,9647,NO_QUERY,5215
5216,@ohfosholb  stay awake girl! partylife,Fri Apr 17 21:50:47 PDT 2009,English,86632,NO_QUERY,5216
5217,My arm huuuurts  My pooor vain   ,Fri Apr 17 21:50:50 PDT 2009,English,104833,NO_QUERY,5217
5218,@MCRmuffin yiu are who i want right now  youy make me feel okay!,Fri Apr 17 21:50:51 PDT 2009,English,80907,NO_QUERY,5218
5219,Just got a ticket in the mail. Boo ,Fri Apr 17 21:50:51 PDT 2009,English,74022,NO_QUERY,5219
5220,@melissamoog I am dying to visit! Unfortunately not happening until the economy picks up...for me ,Fri Apr 17 21:50:52 PDT 2009,English,15855,NO_QUERY,5220
5221,"feels bad for my dad, he's got a fractured rib   Ouch!",Fri Apr 17 21:50:53 PDT 2009,English,106365,NO_QUERY,5221
5222,fucking myspace!! Let me check my new comments nowwwwwww ,Fri Apr 17 21:50:55 PDT 2009,English,28002,NO_QUERY,5222
5223,"cant stay up any later, although im missing my show. ",Fri Apr 17 21:50:56 PDT 2009,English,123020,NO_QUERY,5223
5224,@dirty_snowflake Wow really?? that's crazy! I swear I knew what that was since I was like 14... how sad of me ,Fri Apr 17 21:51:02 PDT 2009,English,77477,NO_QUERY,5224
5225,u guys really need to have another concert in toronto for the day before or the day after like honestly who wants to sit far back ,Fri Apr 17 21:51:04 PDT 2009,English,82107,NO_QUERY,5225
5226,@Venus00 at riot room waiting for the hot wife of fohp's guitar player ,Fri Apr 17 21:51:02 PDT 2009,English,61501,NO_QUERY,5226
5227,@KimKardashian Kim!! That's so bad for your skin..  The sun is a lot stronger in Mexico... it can turn any skin red. Still beautiful tho,Fri Apr 17 21:51:02 PDT 2009,English,17591,NO_QUERY,5227
5228,"im lonely  keep me company! 22 female, Sioux Falls - South Dakota",Fri Apr 17 21:51:03 PDT 2009,English,33310,NO_QUERY,5228
5229,"my body is really hating me today. cut my knee, cut my elbow, cut my toe nail. all bleeding. plus tons of lifting and  moving... ",Fri Apr 17 21:51:04 PDT 2009,English,30026,NO_QUERY,5229
5230,Going to sleep-migraine  but The Rez was great! Have fun all you Rez Twitterers! Drive home safe!,Fri Apr 17 21:51:05 PDT 2009,English,52805,NO_QUERY,5230
5231,Y do I always end up havin to wait for hrs on end for a certain someone to show up ,Fri Apr 17 21:51:13 PDT 2009,English,19117,NO_QUERY,5231
5232,Oh lookey: Nash Bridges ,Fri Apr 17 21:51:14 PDT 2009,English,76431,NO_QUERY,5232
5233,"Had a fun night, although I couldn't help but be worried about poor little Logan. ",Fri Apr 17 21:51:15 PDT 2009,English,19278,NO_QUERY,5233
5234,"the girls are finally sleeping... &amp; even though it's early, i hope to be sleeping soon as well! CEC may not happen tomo.. lani is sick. ",Fri Apr 17 21:51:17 PDT 2009,English,55914,NO_QUERY,5234
5235,@lukepasqualino 2010?? That's a long time from now.  have you guys started filming? I'm way too excited for series 4!,Fri Apr 17 21:51:19 PDT 2009,English,32893,NO_QUERY,5235
5236,@LucasCruikshank aww i forgot it's tomorrow!!!!  i was going to go but i completely FORGOT! I'm so sad now ((((,Fri Apr 17 21:51:20 PDT 2009,English,51426,NO_QUERY,5236
5237,"watching b play video games.  oh well, its his birthday.  looove him. and fracking tired. lacking enough sleep to get through a full day. ",Fri Apr 17 21:51:22 PDT 2009,English,123157,NO_QUERY,5237
5238,i just got hit in the face by a piece of hail.... ,Fri Apr 17 21:51:25 PDT 2009,English,20971,NO_QUERY,5238
5239,what a lame Friday!! I need a vacation ,Fri Apr 17 21:51:31 PDT 2009,English,84435,NO_QUERY,5239
5240,@DJ_Reeves it killed too many of my brain cells ,Fri Apr 17 21:51:31 PDT 2009,English,29434,NO_QUERY,5240
5241,Morrissey is done  waiting for paul mccartney.,Fri Apr 17 21:51:31 PDT 2009,English,14237,NO_QUERY,5241
5242,@iuwii is it true you cant play DS games on the DSi? that would suck ,Fri Apr 17 21:51:35 PDT 2009,English,30558,NO_QUERY,5242
5243,"@msz_ara Naah im juss playin .. aha i just cant put one person on there becus thas unfair to everybody else , then ppl gonna hate me ",Fri Apr 17 21:51:39 PDT 2009,English,15288,NO_QUERY,5243
5244,@yogesh_s working tomorrow so couch time!!!  shae....blotch on my friday night career!!! sigh!!! shit happens unless u r constipated!,Fri Apr 17 21:51:43 PDT 2009,English,12795,NO_QUERY,5244
5245,There's nothing like the smell of a fresh cat deuce while playing #wow dang litterbox. ,Fri Apr 17 21:51:43 PDT 2009,English,101581,NO_QUERY,5245
5246,@NeonicBandit I got pudgy ,Fri Apr 17 21:51:43 PDT 2009,English,31715,NO_QUERY,5246
5247,@jeffreyeas Silver. ,Fri Apr 17 21:51:49 PDT 2009,English,20921,NO_QUERY,5247
5248,wishing i could get tickets to the Johnny reid concert on the 24th....no luck though only upperbowl left ,Fri Apr 17 21:51:55 PDT 2009,English,90531,NO_QUERY,5248
5249,left work early tonight because I am sick. ,Fri Apr 17 21:51:55 PDT 2009,English,35765,NO_QUERY,5249
5250,forgot about surry hills fest  but managed to go to the ever exciting &quot;HOLROYD FEST&quot; in MERRYLANDS --- WOOOOO! *does merrylands gang sign*,Fri Apr 17 21:52:06 PDT 2009,English,88890,NO_QUERY,5250
5251,just got home from work sooo tired..i miss my baby ,Fri Apr 17 21:52:07 PDT 2009,English,20943,NO_QUERY,5251
5252,"my baby boo, love of my lfe, best friend evar is finally tweeting.  or twatting.    @victoriazombie",Fri Apr 17 21:52:10 PDT 2009,English,80721,NO_QUERY,5252
5253,I created a folder called 'To Be Sorted' for random files that needs to be sorted. Now I've got 146 files in the folder. FAIL ,Fri Apr 17 21:52:11 PDT 2009,English,46891,NO_QUERY,5253
5254,misses Delfin E. Deloria III.  http://plurk.com/p/os7qv,Fri Apr 17 21:52:12 PDT 2009,English,24214,NO_QUERY,5254
5255,"It's 1 am. I keep wanting this more and more. I really need to go to sleep, I'm getting to caught up ",Fri Apr 17 21:52:16 PDT 2009,English,78140,NO_QUERY,5255
5256,"@czarthp You wouldn't like it here, I went to bar and ppl were READING...  They were all smelly hippies ",Fri Apr 17 21:52:17 PDT 2009,English,70636,NO_QUERY,5256
5257,my party was totally lame because hardly anyone came. I feel unloved. ,Fri Apr 17 21:52:24 PDT 2009,English,99170,NO_QUERY,5257
5258,Whatching Prison Break  sad only four mor episodes,Fri Apr 17 21:52:25 PDT 2009,English,111745,NO_QUERY,5258
5259,@GreyEyes   heartburn sucks!,Fri Apr 17 21:52:26 PDT 2009,English,5626,NO_QUERY,5259
5260,i had no one to play with me at the park today  hopefully tomorrow isn't so lonely when i attempt to play basketball...,Fri Apr 17 21:52:26 PDT 2009,English,89811,NO_QUERY,5260
5261,Omg worst party ever!!! I just wasted 20 dollars!!! It's takes me a month to work for that!!! ,Fri Apr 17 21:52:26 PDT 2009,English,41839,NO_QUERY,5261
5262,"my baby boo, love of my life, best friend evar is finally tweeting. or twatting.  @victoriazombie",Fri Apr 17 21:52:27 PDT 2009,English,65890,NO_QUERY,5262
5263,"Wont go back to KFC for a while.  Where KFC failed is: I ordered my usual fave, but their guy suggested the &quot;special&quot; instead. Not yum ...",Fri Apr 17 21:52:31 PDT 2009,English,23749,NO_QUERY,5263
5264,I want one. ,Fri Apr 17 21:52:38 PDT 2009,English,33692,NO_QUERY,5264
5265,"I was going to watch the end of the Mariners game (I have a thing for Kenji Jojima), but it's over already ",Fri Apr 17 21:52:43 PDT 2009,English,15394,NO_QUERY,5265
5266,@LaTruce huhuhuhu  i wish i was with you guys... having chickfila... boo school ruins EVERYTHING!!!!!,Fri Apr 17 21:52:47 PDT 2009,English,110494,NO_QUERY,5266
5267,is catching up on his tv shows while getting ready to work this whole weekend ,Fri Apr 17 21:52:50 PDT 2009,English,22123,NO_QUERY,5267
5268,Painfully hungry...  Bring my appetizers plz.,Fri Apr 17 21:55:54 PDT 2009,English,97459,NO_QUERY,5268
5269,"@fairminder Audi A6, fender gone, insurance claims it was a $3000 damage,  and the Merc I hit even more ",Fri Apr 17 21:55:54 PDT 2009,English,31144,NO_QUERY,5269
5270,@HaileyATL her mom always finds something to say to make her not go.. im sure she will if not umm.. idk ,Fri Apr 17 21:55:55 PDT 2009,English,8069,NO_QUERY,5270
5271,Broken gas gauge + mechanic driving my bus = thought I had more gas.  @mattbratcher and @briantruong had to push it to the station.,Fri Apr 17 21:55:59 PDT 2009,English,18201,NO_QUERY,5271
5272,"Boys in the bath, then off to bed!  Can't wait for Bloomin' Fest tomorrow...hoping the weather is good!  Looks bad for Sunday ",Fri Apr 17 21:55:59 PDT 2009,English,97935,NO_QUERY,5272
5273,3 beautiful women here.  all taken. grr. lol,Fri Apr 17 21:56:00 PDT 2009,English,84668,NO_QUERY,5273
5274,"@APHood we may have voting power, but the lobbyist for the banks have the money power. And politicians ALWAYS usually go for the money! ",Fri Apr 17 21:56:03 PDT 2009,English,41442,NO_QUERY,5274
5275,"@perezhilton I'm so sad u feel that way!  I hope u meet him afterwards, he's totally awesome and nice",Fri Apr 17 21:56:06 PDT 2009,English,21765,NO_QUERY,5275
5276,I REALLY REALLY miss U bryan!!  ...,Fri Apr 17 21:56:06 PDT 2009,English,50320,NO_QUERY,5276
