tweet_id,content,posted_at,language,retweet_count,flag,user_id
1702,@natalidelconte Didn't u tweet about Verizon FiOS problems before? Crap! I just signed up ,Tue Apr 07 05:42:09 PDT 2009,English,43609,NO_QUERY,1702
1703,Its my birthday!!!  too bad I have to spend it without the hubby...,Tue Apr 07 05:42:09 PDT 2009,English,75539,NO_QUERY,1703
1704,"@keishaaa can't say it in public, keshkesh  i'll go online on y!m.",Tue Apr 07 05:42:14 PDT 2009,English,121467,NO_QUERY,1704
1705,@jgamet Jeff Gamet is out sick for this week's Design Tools Weekly podcast. I miss him ,Tue Apr 07 05:42:16 PDT 2009,English,71141,NO_QUERY,1705
1706,cant believe i'm sick again. ,Tue Apr 07 05:42:24 PDT 2009,English,32587,NO_QUERY,1706
1707,@wyndwitch I wish I had had to look that one up ,Tue Apr 07 05:42:26 PDT 2009,English,72468,NO_QUERY,1707
1708,my prince was watching me while the photograph took my photos.... embarrassing... ,Tue Apr 07 05:42:29 PDT 2009,English,10912,NO_QUERY,1708
1709,@Rob_Jensen That is a chilly wake up call and $$$$ to boot. Bummer ,Tue Apr 07 05:42:32 PDT 2009,English,55302,NO_QUERY,1709
1710,@stephenfry you passed me outside Costa on Old Compton but it was too late by the time I thought to ask for a twitpic moment ,Tue Apr 07 05:42:33 PDT 2009,English,36020,NO_QUERY,1710
1711,@evarley I think it's Mac only. Sorry ,Tue Apr 07 05:42:47 PDT 2009,English,27940,NO_QUERY,1711
1712,my &lt;3 is so heavy! Another bout of tears. ,Tue Apr 07 05:42:55 PDT 2009,English,47532,NO_QUERY,1712
1713,@MaryBethune I hate school right now! You are lucky you don't have to go! ,Tue Apr 07 05:42:58 PDT 2009,English,82692,NO_QUERY,1713
1714,"@melodyareli Yeah, I don't either  Hopefully if it does, it will be just a fluke and melt right away.",Tue Apr 07 05:42:58 PDT 2009,English,101534,NO_QUERY,1714
1715,Trying to get rid of brightness and alphas in Flash. File keeps exporting with the brightness and alpha in tact. ,Tue Apr 07 05:43:03 PDT 2009,English,21980,NO_QUERY,1715
1716,It�s such a nice day outside. And here�s me stuck at my PC ,Tue Apr 07 05:43:04 PDT 2009,English,121694,NO_QUERY,1716
1717,Buttload of work....i wish people hated cars more ,Tue Apr 07 05:43:12 PDT 2009,English,102794,NO_QUERY,1717
1718,Im wearing dumb running pants ,Tue Apr 07 05:43:13 PDT 2009,English,51393,NO_QUERY,1718
1719,has coffee breath. i need something minty. ,Tue Apr 07 05:43:15 PDT 2009,English,100199,NO_QUERY,1719
1720,"off to  slow start, somewhat planned... the boo had us up much of the night cuz she couldn't breathe - cold+TX allergies ",Tue Apr 07 05:43:18 PDT 2009,English,30009,NO_QUERY,1720
1721,also wants 2 throw a shoe ... ,Tue Apr 07 05:43:20 PDT 2009,English,108388,NO_QUERY,1721
1722,i would love nothing more than to go back to bed and sleep all day... definitely not feeling up to par today ,Tue Apr 07 05:43:22 PDT 2009,English,34929,NO_QUERY,1722
1723,@sskarimi Enjoy the sun! I have to work... ,Tue Apr 07 05:43:26 PDT 2009,English,99059,NO_QUERY,1723
1724,"@pgh_1980 awe.... sorry to hear   What are you up to this weekend?  We need to catch up, I'll be home from friday to sunday!",Tue Apr 07 05:43:30 PDT 2009,English,53372,NO_QUERY,1724
1725,@theellenshow http://twitpic.com/2cepq - You never told your cow story! We were waiting for it. ,Tue Apr 07 05:43:31 PDT 2009,English,7157,NO_QUERY,1725
1726,Ha ha got all excited because I got a new text then realised it was from service provider ,Tue Apr 07 05:43:37 PDT 2009,English,20765,NO_QUERY,1726
1727,Just done 2 Rick Roll's. But then @jaaake3 avoided it ,Tue Apr 07 05:43:39 PDT 2009,English,59013,NO_QUERY,1727
1728,Napoleon is missing ,Tue Apr 07 05:43:45 PDT 2009,English,54267,NO_QUERY,1728
1729,that.. IM MISS MY DAD! ,Tue Apr 07 05:43:48 PDT 2009,English,14987,NO_QUERY,1729
1730,Back to work I go!!  ,Tue Apr 07 05:43:49 PDT 2009,English,100717,NO_QUERY,1730
1731,@McSasha you're really hilarious this morning ,Tue Apr 07 05:43:51 PDT 2009,English,100183,NO_QUERY,1731
1732,i think Alfred is dead but I'm too scared to check ,Tue Apr 07 05:43:55 PDT 2009,English,119719,NO_QUERY,1732
1733,I'm still not feeling very well. Why is it that recently i'm getting sick so often ,Tue Apr 07 05:43:55 PDT 2009,English,12091,NO_QUERY,1733
1734,Back to work. ,Tue Apr 07 05:43:58 PDT 2009,English,61141,NO_QUERY,1734
1735,Really liking the new Yahoo Music Pages http://new.music.yahoo.com/velvet-underground. The only problem is that it uses Rhapsody ,Tue Apr 07 05:44:00 PDT 2009,English,47645,NO_QUERY,1735
1736,@jaime1013 Why does he have to redeem himself....?? And I don't venture into Jordan AO...I don't have time to go everywhere ,Tue Apr 07 05:43:59 PDT 2009,English,187,NO_QUERY,1736
1737,is feeling pretty yucky! got this cold/flu thing going around  BOO,Tue Apr 07 05:44:01 PDT 2009,English,95780,NO_QUERY,1737
1738,@juuliannaaaa  i haven't slept. boo! i wish it snowed here.,Tue Apr 07 05:44:04 PDT 2009,English,18330,NO_QUERY,1738
1739,So. Fell asleep at 630. Class in 15 min till 12. ,Tue Apr 07 05:44:06 PDT 2009,English,50613,NO_QUERY,1739
1740,"Happy Birthday, @rrdad! Too bad you also are travelling today. ",Tue Apr 07 05:44:07 PDT 2009,English,83187,NO_QUERY,1740
1741,"My laptop's broken, so no tweets for a while.  But holidays! Woohoo!",Tue Apr 07 05:44:09 PDT 2009,English,52550,NO_QUERY,1741
1742,cooks rolling to leicester edi if u can put a shouta out 2 tonite its gna b amazing but im not going to be there  lol NEED SOME FOLLOWERS,Tue Apr 07 05:44:11 PDT 2009,English,65051,NO_QUERY,1742
1743,Power outage on Campus Kirchberg (uni.lu). This explains why the prompt on the PS3 I was logged into froze ,Tue Apr 07 05:44:12 PDT 2009,English,46087,NO_QUERY,1743
1744,"I thought it was April....Spring time, but when I woke up, it was SNOWING! ",Tue Apr 07 05:44:17 PDT 2009,English,44163,NO_QUERY,1744
1745,it is snowing ,Tue Apr 07 05:44:17 PDT 2009,English,85028,NO_QUERY,1745
1746,@gabbydario oh yesss it is ! hope it doesnt end  i can hoedown throwdown \m/,Tue Apr 07 05:44:18 PDT 2009,English,84664,NO_QUERY,1746
1747,Chris and I have been up for over an hour and a half while the rest of the family sleeps. Yay Pacific time! ,Tue Apr 07 05:44:23 PDT 2009,English,15748,NO_QUERY,1747
1748,"Poor Britney. As if it's not hard enough being her, she also ust got pwned by Stevie Nicks... ",Tue Apr 07 05:44:24 PDT 2009,English,8958,NO_QUERY,1748
1749,I forgot my donut holes in the car ,Tue Apr 07 05:44:28 PDT 2009,English,83533,NO_QUERY,1749
1750,Hmm... Not good meeting someone you know and...like when you're all sweaty and grungy. Wish they had showers in here. ,Tue Apr 07 05:44:31 PDT 2009,English,121548,NO_QUERY,1750
1751,is hungry....must go grocery shopping...no juice ,Tue Apr 07 05:44:33 PDT 2009,English,125430,NO_QUERY,1751
1752,"Painfully slow night, made more painful by a serious lack of sleep ",Tue Apr 07 05:44:33 PDT 2009,English,76006,NO_QUERY,1752
1753,"Unfortunately, I didn't wake up from my nap  Sorry, @GloriaLynn30",Tue Apr 07 05:44:35 PDT 2009,English,7288,NO_QUERY,1753
1754,is not wanting to work this week.....i want a vacation!!! ,Tue Apr 07 05:44:35 PDT 2009,English,93697,NO_QUERY,1754
1755,off 2 work soon ,Tue Apr 07 05:44:37 PDT 2009,English,2557,NO_QUERY,1755
1756,Feels like she is gonna throw up ,Tue Apr 07 05:44:38 PDT 2009,English,124597,NO_QUERY,1756
1757,@angelajames Oh no! I hope it's minor &amp; easily/cheaply fixed. ,Tue Apr 07 05:44:41 PDT 2009,English,18859,NO_QUERY,1757
1758,"@TomAtChemical Rubbish  At least we're having curry for tea, so that should cheer you up!!",Tue Apr 07 05:44:43 PDT 2009,English,21511,NO_QUERY,1758
1759,"I need either a new phone with all the cool crap on it, or a good digital camera.... ",Tue Apr 07 05:44:43 PDT 2009,English,84112,NO_QUERY,1759
1760,zac deleted his twitter account..how sad.. ,Tue Apr 07 05:44:45 PDT 2009,English,124286,NO_QUERY,1760
1761,@Gnomewise but.. but.. i like my   o_O graphic  ,Tue Apr 07 05:44:47 PDT 2009,English,81960,NO_QUERY,1761
1762,im going to lose followers by doing this  but i have no one to tweet to! lol,Tue Apr 07 05:44:47 PDT 2009,English,92482,NO_QUERY,1762
1763,and i still want to go pleasure beach at blackpool ,Tue Apr 07 05:44:53 PDT 2009,English,6094,NO_QUERY,1763
1764,this stupid cold is taking over me  I just want my bed now,Tue Apr 07 05:47:02 PDT 2009,English,75655,NO_QUERY,1764
1765,@PaulMdx  Visual studio doesn't  let me draw things quick enough when I'm trying to explain a concept ,Tue Apr 07 05:47:02 PDT 2009,English,112251,NO_QUERY,1765
1766,waiting on Ms.Mitchell  I hate waiting ,Tue Apr 07 05:47:05 PDT 2009,English,89931,NO_QUERY,1766
1767,This is insanity! I can't handle all this crap at work ,Tue Apr 07 05:47:06 PDT 2009,English,75266,NO_QUERY,1767
1768,WHY IS IT SNOWING AGAIN ?!      ,Tue Apr 07 05:47:07 PDT 2009,English,73728,NO_QUERY,1768
1769,"I hate being sick, too much wasted time and energy!   Wish me well so I can get back to my busy life, lol",Tue Apr 07 05:47:07 PDT 2009,English,85874,NO_QUERY,1769
1770,@Schofe my Boyfriend says u wont reply to me  please prove him wrong lol!! xx,Tue Apr 07 05:47:15 PDT 2009,English,67110,NO_QUERY,1770
1771,I just saw next doors dalmation escape their garden and nearly get run over!  be careful lil pup!!!,Tue Apr 07 05:47:19 PDT 2009,English,338,NO_QUERY,1771
1772,"@sheslykeomg well I told her off a few weeks ago and she's on a downward spiral ever since. If you even mention my name, she goes nuts. ",Tue Apr 07 05:47:23 PDT 2009,English,112396,NO_QUERY,1772
1773,Prodigy are playing in Glasgow tonight &amp; I can't go  Gutted! 12 years since I last saw them!,Tue Apr 07 05:47:24 PDT 2009,English,122891,NO_QUERY,1773
1774,@snarkybitch some bird keeps waking me up right now. I wish it would shut up. ,Tue Apr 07 05:47:34 PDT 2009,English,60446,NO_QUERY,1774
1775,says walang RC  http://plurk.com/p/n1vzj,Tue Apr 07 05:47:37 PDT 2009,English,36100,NO_QUERY,1775
1776,"Upset that my cat won't take her medicine, again.  ",Tue Apr 07 05:47:37 PDT 2009,English,97624,NO_QUERY,1776
1777,Tax day it is! Started the tedious task by saying hello to my  friend Turbo Tax. It is such a fun day I can't even put into words ,Tue Apr 07 05:47:42 PDT 2009,English,79229,NO_QUERY,1777
1778,Everything hurts...uh! ,Tue Apr 07 05:47:47 PDT 2009,English,37536,NO_QUERY,1778
1779,wow I missed a lot on Twitter last night!!....I'm soo sleepy ,Tue Apr 07 05:47:48 PDT 2009,English,49375,NO_QUERY,1779
1780,still high from primer fumes... and joe said i have to put on a second coat ,Tue Apr 07 05:47:51 PDT 2009,English,33745,NO_QUERY,1780
1781,@Kemia wish you were here in 1st period.  imy!,Tue Apr 07 05:47:53 PDT 2009,English,28814,NO_QUERY,1781
1782,"@Jessica___xx i can't smile,i dunno how to atm  iloveyou xoxo",Tue Apr 07 05:47:55 PDT 2009,English,125759,NO_QUERY,1782
1783,"is wearing nothing but a sarong as a house dress. Have to, weather feels heavy and humid  http://plurk.com/p/n1w2g",Tue Apr 07 05:47:58 PDT 2009,English,50773,NO_QUERY,1783
1784,"Just had a lovely avacado, bacon and chicken baguette - now time for more work ",Tue Apr 07 05:48:00 PDT 2009,English,98168,NO_QUERY,1784
1785,blow drying my hair and getting ready to go to school ,Tue Apr 07 05:48:01 PDT 2009,English,33261,NO_QUERY,1785
1786,"I can't believe that it's cold outside and it's April!  It's Spring, but I had a hot winter, so now I'm going to have a cold Spring. ",Tue Apr 07 05:48:05 PDT 2009,English,79672,NO_QUERY,1786
1787,"Sick, i guess no FTSK show tonight. ",Tue Apr 07 05:48:04 PDT 2009,English,85183,NO_QUERY,1787
1788,@RicardoTech Unfortunately I'm not allowed to splurge it all  Otherwise it'd be a netbook and a DSi for sure...Now I have to choose one,Tue Apr 07 05:48:22 PDT 2009,English,17729,NO_QUERY,1788
1789,New Xserve's. New higher price. No surprise there then ,Tue Apr 07 05:48:24 PDT 2009,English,113908,NO_QUERY,1789
1790,"Oh no, my server has just died  support (e.g. brother-in-law) are onto it though",Tue Apr 07 05:48:32 PDT 2009,English,107671,NO_QUERY,1790
1791,"@lisaseat I didn't feel up for it, I didn't fancy failing five times in a row  lost my �50 though",Tue Apr 07 05:48:34 PDT 2009,English,62560,NO_QUERY,1791
1792,"At work  tiiiiiiiiired in Oshkosh, WI",Tue Apr 07 05:48:34 PDT 2009,English,12043,NO_QUERY,1792
1793,"at work, although I think I should be at home, in bed, instead... ",Tue Apr 07 05:48:37 PDT 2009,English,35471,NO_QUERY,1793
1794,@seguima Weather not looking good ,Tue Apr 07 05:48:37 PDT 2009,English,37069,NO_QUERY,1794
1795,Giants first game tonight! But I have a meeting during most of it ,Tue Apr 07 05:48:38 PDT 2009,English,109244,NO_QUERY,1795
1796,Missing Jacks &amp; Mottu very much ,Tue Apr 07 05:48:44 PDT 2009,English,59013,NO_QUERY,1796
1797,Feeling doubly guilty for eating a tube of Fruit Pastilles ,Tue Apr 07 05:48:44 PDT 2009,English,96437,NO_QUERY,1797
1798,is not loving this snow ,Tue Apr 07 05:48:45 PDT 2009,English,32341,NO_QUERY,1798
1799,@honk4peace Never received any DMs last night.    Twitter was hacking up a lung or something.,Tue Apr 07 05:48:47 PDT 2009,English,4357,NO_QUERY,1799
1800,"is feeling coldy, yucky and gross...i need nursing and cuddles ",Tue Apr 07 05:48:51 PDT 2009,English,62700,NO_QUERY,1800
1801,"Gah! Its +15 outside, and i'm stuck in this shit hole building till 6:00! Why me!?!? ",Tue Apr 07 05:49:04 PDT 2009,English,122022,NO_QUERY,1801
1802,"@thomasfromleeds hey thomas! been very busy, but busy smiling too! apart from last night when i got the wolves score ",Tue Apr 07 05:49:08 PDT 2009,English,10854,NO_QUERY,1802
1803,I really hate classes that are a waste of time. ,Tue Apr 07 05:49:09 PDT 2009,English,80528,NO_QUERY,1803
1804,"Ugh, fixed my #iPhone syncing issue,  just two days ago, now it's back again. Not happy. ",Tue Apr 07 05:49:11 PDT 2009,English,23078,NO_QUERY,1804
1805,I wish I could go back to bed because its 28 flippin degrees out... ,Tue Apr 07 05:49:16 PDT 2009,English,108480,NO_QUERY,1805
1806,Ugh... Trraaffiiic... ,Tue Apr 07 05:49:16 PDT 2009,English,69173,NO_QUERY,1806
1807,@CarlyRush a mile and a half from my house. ,Tue Apr 07 05:49:17 PDT 2009,English,61827,NO_QUERY,1807
1808,gonna be a hard day... not sure about this exam ,Tue Apr 07 05:49:21 PDT 2009,English,113319,NO_QUERY,1808
1809,"@SharneseLaNier very good morning for me, i have traffic court 2day ",Tue Apr 07 05:49:21 PDT 2009,English,9333,NO_QUERY,1809
1810,Ah! Can't decide what to buy for birthday ,Tue Apr 07 05:49:29 PDT 2009,English,65785,NO_QUERY,1810
1811,"ugh. i'm slightly sore... need more sleep but no, gotta get to work. ",Tue Apr 07 05:49:29 PDT 2009,English,41868,NO_QUERY,1811
1812,"Today is very cold, so cold I may have to start wearing my jeans again  yesterday was raining but I did get some good shots of ducks ",Tue Apr 07 05:49:29 PDT 2009,English,4235,NO_QUERY,1812
1813,sorting the kitchen out! ,Tue Apr 07 05:49:29 PDT 2009,English,60215,NO_QUERY,1813
1814,@RockinRita So once again our plans fell through to meet up. ,Tue Apr 07 05:49:31 PDT 2009,English,6645,NO_QUERY,1814
1815,I just ate an uncooked pizza ,Tue Apr 07 05:49:33 PDT 2009,English,44164,NO_QUERY,1815
1816,get it in tuesdays ,Tue Apr 07 05:49:34 PDT 2009,English,69357,NO_QUERY,1816
1817,Just woke up...another 10 hour shift today   Started a pally last night...she kicks butt!!!,Tue Apr 07 05:49:36 PDT 2009,English,49825,NO_QUERY,1817
1818,davepeckens: @honk4peace Never received any DMs last night.  Twitter was hacking up a lung or something.,Tue Apr 07 05:49:43 PDT 2009,English,27266,NO_QUERY,1818
1819,wishes she could make a difference... ,Tue Apr 07 05:49:46 PDT 2009,English,34634,NO_QUERY,1819
1820,"@MacHeist Throw in Leopard and I'll not only buy a bundle I'll get 5 others to do the same!  Most ap's require Leopard, and me no gots. ",Tue Apr 07 05:49:55 PDT 2009,English,59451,NO_QUERY,1820
1821,cant get full screen though ,Tue Apr 07 05:49:57 PDT 2009,English,39756,NO_QUERY,1821
1822,is way too illin' to go out this day   Perhaps someone could send me well wishes?,Tue Apr 07 05:49:58 PDT 2009,English,116522,NO_QUERY,1822
1823,"@frijoleplus Wow, that didn't take long.  ",Tue Apr 07 05:49:59 PDT 2009,English,119873,NO_QUERY,1823
1824,"@techathead no, but my blackjak's media player is corrupt (even tho it's in ROM) so also won't ring. They say I need to get a replacement ",Tue Apr 07 05:50:07 PDT 2009,English,87740,NO_QUERY,1824
1825,"stayed home from school, lost all my feeling in my right arm i doubt because of my broken finger(typing with one hand is harrddd) ",Tue Apr 07 05:50:07 PDT 2009,English,39646,NO_QUERY,1825
1826,Going through the motions when I just want to go right back to bed. ,Tue Apr 07 05:50:06 PDT 2009,English,57493,NO_QUERY,1826
1827,awake now  sleep = bad when u have overcooked yourself!,Tue Apr 07 05:50:08 PDT 2009,English,31347,NO_QUERY,1827
1828,"The change in weather is affecting Connor too, he's snuffly today, poor thing. ",Tue Apr 07 05:51:59 PDT 2009,English,119859,NO_QUERY,1828
1829,@atl Lame!!! That's a big bummer. ,Tue Apr 07 05:52:00 PDT 2009,English,83950,NO_QUERY,1829
1830,I need to go to bed earlier ,Tue Apr 07 05:52:00 PDT 2009,English,101813,NO_QUERY,1830
1831,@dysconnection is very jealous of Birmingham ,Tue Apr 07 05:52:06 PDT 2009,English,89259,NO_QUERY,1831
1832,@ferasinatra @DonnieWsboo09 sigh i just went on donnie's page and saw the sad truth....sorry for the misleading info ,Tue Apr 07 05:52:06 PDT 2009,English,38139,NO_QUERY,1832
1833,It's cold out and my breakfast sandwich is hard ,Tue Apr 07 05:52:09 PDT 2009,English,46434,NO_QUERY,1833
1834,@Ginger_Hippie  that's scary,Tue Apr 07 05:52:10 PDT 2009,English,36376,NO_QUERY,1834
1835,I can't go back to sleep. My buddy spots will soon be no more ,Tue Apr 07 05:52:11 PDT 2009,English,77295,NO_QUERY,1835
1836,@DirtyA lolll. Nooo  then i'm back to my protein diet!! Maybe on a cheat day,Tue Apr 07 05:52:12 PDT 2009,English,57720,NO_QUERY,1836
1837,@charliehedges Im glad your having a good second day off- i've spent my 2nd day having to do the garden  too many bugs-not my style!,Tue Apr 07 05:52:15 PDT 2009,English,30310,NO_QUERY,1837
1838,Woke up with a migraine  today can't even put contacts in its so bad. Wish I could call into work but can't hope the babies are not fussy ,Tue Apr 07 05:52:17 PDT 2009,English,89120,NO_QUERY,1838
1839,where is everyone ,Tue Apr 07 05:52:23 PDT 2009,English,17447,NO_QUERY,1839
1840,"The only reason why I bough @MacHeist 3 Bundle was Espresso. This is, however, the only App. I haven't received a license key yet   ",Tue Apr 07 05:52:26 PDT 2009,English,80846,NO_QUERY,1840
1841,Good morning everybody! Hope you didn't wake up to snow on the ground like we did. Arggghhh! My poor tulips; I can see them shivering ,Tue Apr 07 05:52:30 PDT 2009,English,10026,NO_QUERY,1841
1842,My Piggie is ill ,Tue Apr 07 05:52:33 PDT 2009,English,95983,NO_QUERY,1842
1843,@R_Sinclair I'm gonna go with bible bashing. Get them all the time round my way ,Tue Apr 07 05:52:34 PDT 2009,English,53387,NO_QUERY,1843
1844,Not matter how much time I spend in the sun I don't ever get a tan  just get silly freckles.,Tue Apr 07 05:52:40 PDT 2009,English,73978,NO_QUERY,1844
1845,@Tnkdifferent ,Tue Apr 07 05:52:46 PDT 2009,English,53598,NO_QUERY,1845
1846,@klovehearne awe girl im sorry   i hope you feel better!,Tue Apr 07 05:52:49 PDT 2009,English,43235,NO_QUERY,1846
1847,"@Kal_Penn The episode broke my heart, even though we'd speculated that this was what was coming   Will miss you terribly on the show.",Tue Apr 07 05:52:49 PDT 2009,English,50471,NO_QUERY,1847
1848,"@freshfelicity I prefer foraging too! But will buy if I have to. Richmond is fairly far, I am in Zone 3 NE London ",Tue Apr 07 05:52:50 PDT 2009,English,100876,NO_QUERY,1848
1849,my throat is killing me ,Tue Apr 07 05:52:56 PDT 2009,English,85402,NO_QUERY,1849
1850,Meeting Time!!! Is it Friday yet??? ,Tue Apr 07 05:52:57 PDT 2009,English,22546,NO_QUERY,1850
1851,"@auroracelese Aww, no Emerald Dream? I was looking forward to questing with you later. ",Tue Apr 07 05:52:57 PDT 2009,English,69744,NO_QUERY,1851
1852,@belladonna20 I've had a well unproductive morning! ,Tue Apr 07 05:53:05 PDT 2009,English,63902,NO_QUERY,1852
1853,bored looking for something to do  any ideas?? xXx,Tue Apr 07 05:53:10 PDT 2009,English,104951,NO_QUERY,1853
1854,@pattigibbons Ha! Good one!  The snow missed us completely.  ,Tue Apr 07 05:53:13 PDT 2009,English,2667,NO_QUERY,1854
1855,Deep papercut on miles to go.  :/...listening to music.,Tue Apr 07 05:53:13 PDT 2009,English,77188,NO_QUERY,1855
1856,Last day of health class  so sad. @TomFelton those pancakes sound good! can i have some?,Tue Apr 07 05:53:15 PDT 2009,English,39033,NO_QUERY,1856
1857,Sick as shit.  I really want to drink some water. :/,Tue Apr 07 05:53:18 PDT 2009,English,105631,NO_QUERY,1857
1858,"is missing her best friend   but hoping the happy, cold couple is having a good time and does not forget the Imo's Pizza.",Tue Apr 07 05:53:25 PDT 2009,English,54704,NO_QUERY,1858
1859,Ug msu got killed last night. Oh well unc out played them. I would have won 140 in the work pool if msu had won. ,Tue Apr 07 05:53:26 PDT 2009,English,28287,NO_QUERY,1859
1860,awwww mann i need followers im a loser ,Tue Apr 07 05:53:27 PDT 2009,English,104790,NO_QUERY,1860
1861,"You're all obsessed with this thing...So much to read, so little time! Got work in a few hours ",Tue Apr 07 05:53:33 PDT 2009,English,59138,NO_QUERY,1861
1862,last trig test til finals ,Tue Apr 07 05:53:34 PDT 2009,English,90952,NO_QUERY,1862
1863,Inadvertently I dressed jack in a light blue shirt. Sports fail ,Tue Apr 07 05:53:35 PDT 2009,English,59201,NO_QUERY,1863
1864,is going to miss her doggy Otis very much. 11 years of wonderful companionship for us all darling boy  Rest in peace ,Tue Apr 07 05:53:38 PDT 2009,English,20543,NO_QUERY,1864
1865,No new Tom music? ,Tue Apr 07 05:53:56 PDT 2009,English,44836,NO_QUERY,1865
1866,I though groups of Google Apps were something like Google groups (groups.google.com) ,Tue Apr 07 05:53:58 PDT 2009,English,2815,NO_QUERY,1866
1867,would have liked to have gotten more sleep last night! ,Tue Apr 07 05:54:00 PDT 2009,English,53177,NO_QUERY,1867
1868,@hinehou Ohhh i always wanted to go to #Chow as well! ,Tue Apr 07 05:54:08 PDT 2009,English,106965,NO_QUERY,1868
1869,Feels like I'm really coming down with something ,Tue Apr 07 05:54:17 PDT 2009,English,92634,NO_QUERY,1869
1870,Having a really hard time focusing today ,Tue Apr 07 05:54:18 PDT 2009,English,5642,NO_QUERY,1870
1871,i want to visit @louise_hendy at work but i cant ,Tue Apr 07 05:54:20 PDT 2009,English,47577,NO_QUERY,1871
1872,"Been at the computer so much today, my vision is blurred ",Tue Apr 07 05:54:24 PDT 2009,English,6801,NO_QUERY,1872
1873,officially over. broken hearted ,Tue Apr 07 05:54:24 PDT 2009,English,38229,NO_QUERY,1873
1874,"@magnla Uhhhhh, Spring arrived a week or two ago, and then left.  Heh.",Tue Apr 07 05:54:25 PDT 2009,English,20316,NO_QUERY,1874
1875,I think our coffee pot died ,Tue Apr 07 05:54:26 PDT 2009,English,65805,NO_QUERY,1875
1876,"Still in the center of Lincoln wandering aimlessly round shops, wish I cud think of something to o. iPhone running slow ",Tue Apr 07 05:54:26 PDT 2009,English,43080,NO_QUERY,1876
1877,why can't my pix be uploaded?!? ,Tue Apr 07 05:54:26 PDT 2009,English,105375,NO_QUERY,1877
1878,@DelphaForce How'd you guess!? She's deaf actually. She's orf to t'clinic soon. Lost all her high frequency &amp; will have tinnitis forever ,Tue Apr 07 05:54:27 PDT 2009,English,4740,NO_QUERY,1878
1879,Is in lake charles for an orthodontist appt. ,Tue Apr 07 05:54:28 PDT 2009,English,48559,NO_QUERY,1879
1880,@grift24 lol gladly! i made a lot! but I can't bring it to school ,Tue Apr 07 05:54:27 PDT 2009,English,90200,NO_QUERY,1880
1881,My gmail is down... oooooooooooohhhhhhhhh ,Tue Apr 07 05:54:33 PDT 2009,English,99505,NO_QUERY,1881
1882,@dtoews you'll have to wait a few more months... the backyard is still snowy. ,Tue Apr 07 05:54:37 PDT 2009,English,64462,NO_QUERY,1882
1883,all smoked. my rabbit is so cute. but he hates me ,Tue Apr 07 05:54:39 PDT 2009,English,111353,NO_QUERY,1883
1884,Up early studying ,Tue Apr 07 05:54:42 PDT 2009,English,6672,NO_QUERY,1884
1885,@mrskutcher stop showing off  UNFAIR!,Tue Apr 07 05:54:42 PDT 2009,English,64341,NO_QUERY,1885
1886,@iamschnurr I agree.  Cleaning my car off made me really cold though ,Tue Apr 07 05:54:44 PDT 2009,English,25701,NO_QUERY,1886
1887,"@GirlsGoneChild i'm sorry... go hold that little fable and inhale. feel better, sweet rebecca... ",Tue Apr 07 05:54:48 PDT 2009,English,22653,NO_QUERY,1887
1888,Photo field trip today. (: I just wish it wasn't so cold. ,Tue Apr 07 05:54:49 PDT 2009,English,111947,NO_QUERY,1888
1889,Puffy eyes are awesome!  I don't even have a good story to go along with it ,Tue Apr 07 05:54:50 PDT 2009,English,23963,NO_QUERY,1889
1890,@LeeLeeee yeah i have. looked/phoned/knocked on doors/put up 'missing' posters. and....nothing.... ,Tue Apr 07 05:54:50 PDT 2009,English,26061,NO_QUERY,1890
1891,@StyleNBeautyDoc i tried to leave a comment for rx brown skin  it wouldnt let me,Tue Apr 07 05:54:52 PDT 2009,English,46554,NO_QUERY,1891
1892,wonders why I always don't have a signal? I'm using Globe  http://plurk.com/p/n1xjj,Tue Apr 07 05:54:54 PDT 2009,English,10943,NO_QUERY,1892
1893,is sooooooooo tired ,Tue Apr 07 05:54:53 PDT 2009,English,107308,NO_QUERY,1893
1894,@Bethness Me = jealous. Wish I was at home ,Tue Apr 07 05:55:00 PDT 2009,English,51067,NO_QUERY,1894
1895,really wishes her jaw would stop hurting.  ,Tue Apr 07 05:55:01 PDT 2009,English,35471,NO_QUERY,1895
1896,So the weather officially got worse it is now snowing here ,Tue Apr 07 05:55:04 PDT 2009,English,82110,NO_QUERY,1896
1897,The perfect girl for me is sitting in a cubicle next to me... unfortunately she's already taken ,Tue Apr 07 05:57:14 PDT 2009,English,96028,NO_QUERY,1897
