tweet_id,content,posted_at,language,retweet_count,flag,user_id
3409,"This is a lot harder than I realized, but I know this is the only way to go in order to be happy in the long run.  Just right now it sucks",Tue Apr 07 07:43:24 PDT 2009,English,75095,NO_QUERY,3409
3410,School  I need to get in the zone for the game against Livermore today.,Tue Apr 07 07:43:26 PDT 2009,English,93843,NO_QUERY,3410
3411,haha! its amazing isnt it! miss you! i wanna come back ,Tue Apr 07 07:43:31 PDT 2009,English,82839,NO_QUERY,3411
3412,@josephraymond I feel ya on that one. ,Tue Apr 07 07:43:31 PDT 2009,English,87698,NO_QUERY,3412
3413,my butt hurts. ,Tue Apr 07 07:43:31 PDT 2009,English,59885,NO_QUERY,3413
3414,@FaeQueen omg thats horrible  I hope the rest of your day gets better I hope the geese is ok,Tue Apr 07 07:43:34 PDT 2009,English,120704,NO_QUERY,3414
3415,has a really bad headache..or should say a neck ache..gahh and im nauseated. this sucks ,Tue Apr 07 07:43:35 PDT 2009,English,20449,NO_QUERY,3415
3416,"@kevinhoctor Sure am, booking flights and tickets this week... hopefully see you there! I have regular sized business cards now though ",Tue Apr 07 07:43:42 PDT 2009,English,28901,NO_QUERY,3416
3417,Ffffuuuu the dress i wanted to buy is sold out ,Tue Apr 07 07:43:45 PDT 2009,English,76902,NO_QUERY,3417
3418,Taking my dog to the vet soon  I hope everythings okay with her ,Tue Apr 07 07:43:46 PDT 2009,English,8892,NO_QUERY,3418
3419,In class ,Tue Apr 07 07:43:46 PDT 2009,English,65511,NO_QUERY,3419
3420,"Bored, woke up too early...   Still got another hour...   ",Tue Apr 07 07:43:48 PDT 2009,English,52973,NO_QUERY,3420
3421,shit what at House. Kutner! ,Tue Apr 07 07:43:48 PDT 2009,English,9990,NO_QUERY,3421
3422,@evernote crashed two time while creating new note after my last update... (Mac) ,Tue Apr 07 07:43:57 PDT 2009,English,8113,NO_QUERY,3422
3423,@Shar_ds @cazm I'm not going to make it  way way to ill....,Tue Apr 07 07:43:57 PDT 2009,English,2963,NO_QUERY,3423
3424,disappointed he missed the new Star Trek last night. ,Tue Apr 07 07:44:01 PDT 2009,English,49904,NO_QUERY,3424
3425,"@pedrogaspar I thought I was the only one with &quot;tab'itis&quot;...  I get &quot;attached&quot; to the open tabs with articles, code, etc... :/",Tue Apr 07 07:44:04 PDT 2009,English,69637,NO_QUERY,3425
3426,Need to arrange my car insurance ,Tue Apr 07 07:44:05 PDT 2009,English,72919,NO_QUERY,3426
3427,"Had stress relieved, now it has returned ",Tue Apr 07 07:44:04 PDT 2009,English,112036,NO_QUERY,3427
3428,so failing... 2 outta 5 classes aint too bad ,Tue Apr 07 07:44:07 PDT 2009,English,81297,NO_QUERY,3428
3429,"I can't, in my conscience, join anything which includes neo-cons. ",Tue Apr 07 07:44:09 PDT 2009,English,122650,NO_QUERY,3429
3430,Sad! Chris has to work on Easter ,Tue Apr 07 07:44:08 PDT 2009,English,83343,NO_QUERY,3430
3431,First time to go negative in my bank account!!  i am not a happy camper!! what was i thinking!,Tue Apr 07 07:44:12 PDT 2009,English,42131,NO_QUERY,3431
3432,Forgot to set my alarm and woke up after the sun...gona be late to work ,Tue Apr 07 07:44:15 PDT 2009,English,58646,NO_QUERY,3432
3433,I miss singing already ,Tue Apr 07 07:44:19 PDT 2009,English,92679,NO_QUERY,3433
3434,"@saldtprecords dang near snowing, its snow flurries  from sandals to boots again. crazy",Tue Apr 07 07:44:20 PDT 2009,English,53119,NO_QUERY,3434
3435,booo to that test i just took ,Tue Apr 07 07:44:20 PDT 2009,English,114975,NO_QUERY,3435
3436,Last day at Maya's  Chilling out and then off to Syracuse to see Emily.,Tue Apr 07 07:44:21 PDT 2009,English,37278,NO_QUERY,3436
3437,What's the best tool for sharing pictures on Twitter? I noticed that @henriliriani created dznr.org but I'm not invited to that party ,Tue Apr 07 07:44:24 PDT 2009,English,55835,NO_QUERY,3437
3438,There are ants crawling around in my room. ,Tue Apr 07 07:44:25 PDT 2009,English,82587,NO_QUERY,3438
3439,"@zoolynegron i'll pay for your ticket, and you can pay me back. i dont wanna go alone ",Tue Apr 07 07:44:24 PDT 2009,English,27554,NO_QUERY,3439
3440,@starry___eyed haha its amazing right! i miss you! i wanna come back ,Tue Apr 07 07:44:34 PDT 2009,English,36838,NO_QUERY,3440
3441,"@bcuban come on man, don't jinx the Pirates ",Tue Apr 07 07:44:36 PDT 2009,English,92102,NO_QUERY,3441
3442,too much work to do ,Tue Apr 07 07:44:36 PDT 2009,English,36477,NO_QUERY,3442
3443,"@lucyrider Haha, our windows are barred. I'm a prisoner 9-5! I wish I was joking  Such a beautiful day too!",Tue Apr 07 07:44:38 PDT 2009,English,91521,NO_QUERY,3443
3444,is bored and haven't a clue what to do ,Tue Apr 07 07:44:40 PDT 2009,English,120650,NO_QUERY,3444
3445,@itsallgoood wats wronggg?? ,Tue Apr 07 07:44:42 PDT 2009,English,95195,NO_QUERY,3445
3446,iTunes rolls out variable pricing for songs ,Tue Apr 07 07:44:46 PDT 2009,English,14159,NO_QUERY,3446
3447,is cold at work again today...I gotta remember to pack my SNUGGIE in my car ,Tue Apr 07 07:44:47 PDT 2009,English,67120,NO_QUERY,3447
3448,@ttaylorbear that's me every morning ,Tue Apr 07 07:44:49 PDT 2009,English,72769,NO_QUERY,3448
3449,@ConfessionsMom I would LOVE to be a stay-at-home mom.  Right now I work outside the home   Thanks for checking it out!,Tue Apr 07 07:44:50 PDT 2009,English,89578,NO_QUERY,3449
3450,Setting up a new VMWare Image for .NET dev.  2 hours later I'm on my 4th windows restart and still haven't got everything installed yet ,Tue Apr 07 07:44:50 PDT 2009,English,98106,NO_QUERY,3450
3451,OMG! I hate this snow!   3 Days till David Cook!  &lt;Hebrews 13:8&gt;,Tue Apr 07 07:44:51 PDT 2009,English,16208,NO_QUERY,3451
3452,To the theatre again. Determined to see more than the last 40 minutes of the show today. 1st act sounds hilarious but have yet to see it ,Tue Apr 07 07:44:51 PDT 2009,English,114670,NO_QUERY,3452
3453,My blog's mysql is down.. ,Tue Apr 07 07:44:54 PDT 2009,English,52470,NO_QUERY,3453
3454,@surblimity hope they are treating you well! Hospitals are no fun ,Tue Apr 07 07:44:57 PDT 2009,English,61961,NO_QUERY,3454
3455,Has two essays to do by tomorrow morning. All I want to do is SLEEP. I'm so tired. ,Tue Apr 07 07:45:02 PDT 2009,English,29833,NO_QUERY,3455
3456,Couldn't get twitter to work last night ,Tue Apr 07 07:45:02 PDT 2009,English,45049,NO_QUERY,3456
3457,"has no internet access and needs an iPhone, clearly, to keep up with Twitter. Life without Twitter is not the same ",Tue Apr 07 07:45:04 PDT 2009,English,122780,NO_QUERY,3457
3458,"Remember that laundry I was lamenting about last night? Well, it's still there. The laundry fairy didn't come take care of it. ",Tue Apr 07 07:45:04 PDT 2009,English,102659,NO_QUERY,3458
3459,@SheridanBlock Aww I am sorry!  lol yu saw the HIlls too.. I wanna watch the season to see why Spencer calls LC to appologize lmao!,Tue Apr 07 07:45:04 PDT 2009,English,19130,NO_QUERY,3459
3460,is not very happy today! ,Tue Apr 07 07:45:05 PDT 2009,English,1147,NO_QUERY,3460
3461,I think im gettin a cold ,Tue Apr 07 07:45:08 PDT 2009,English,77450,NO_QUERY,3461
3462,So. Kutner is leaving Housee for Obama. I don't know how I feel about that. ,Tue Apr 07 07:45:09 PDT 2009,English,54892,NO_QUERY,3462
3463,the car has to saty with dr Toyota overnight..... ,Tue Apr 07 07:45:09 PDT 2009,English,33771,NO_QUERY,3463
3464,@adders -Have you asked IT why bit.ly is inaccessible? I'm now unable to read any of the articles my readers are tweeting to me ,Tue Apr 07 07:45:11 PDT 2009,English,29547,NO_QUERY,3464
3465,@Katsweat you never told me the ilaa horror stories. And I will be out of my rut when this damn headache goes away. ,Tue Apr 07 07:45:15 PDT 2009,English,118293,NO_QUERY,3465
3466,@lenejohansen I had to reschedule bc a throat infection kept me home yesterday ,Tue Apr 07 07:45:18 PDT 2009,English,10654,NO_QUERY,3466
3467,@vix7 I swear I'm going to unfollow you ,Tue Apr 07 07:45:24 PDT 2009,English,27830,NO_QUERY,3467
3468,Didn't sleep well last night. Thought about that little girl and what she probably had to go through before she died. So sad. ,Tue Apr 07 07:45:23 PDT 2009,English,31029,NO_QUERY,3468
3469,@drdogbert @novawildstar guilty as charged! ,Tue Apr 07 07:45:30 PDT 2009,English,91162,NO_QUERY,3469
3470,@rhonnie_mcfly What about me? ,Tue Apr 07 07:45:30 PDT 2009,English,114854,NO_QUERY,3470
3471,"Wish Blake Griffin would stay one more year, but I know better ",Tue Apr 07 07:45:35 PDT 2009,English,113558,NO_QUERY,3471
3472,@varniee BUT I'M TIIIIRED!  you cruel girl.,Tue Apr 07 07:45:34 PDT 2009,English,4064,NO_QUERY,3472
3473,"@ellylaine We didn't make it in the end  massive queues on the M25 then took wrong turn right near Wembley itself, gutted! x",Tue Apr 07 07:45:38 PDT 2009,English,47136,NO_QUERY,3473
3474,for those of you thinking i hate the yankees - i dont. i'm a yankees fan.  and losing to the orioles no less ,Tue Apr 07 07:45:38 PDT 2009,English,101565,NO_QUERY,3474
3475,"At work, tho its friday its an awful friday, they have my take n income n calls for 9 hrs when I usually make outbound calls, what a day ",Tue Apr 07 07:45:38 PDT 2009,English,116458,NO_QUERY,3475
3476,"i have had 5 prank calls in 2 days, some the same, some COMPLETELY different... i really wanna know who it is! ",Tue Apr 07 07:45:41 PDT 2009,English,107546,NO_QUERY,3476
3477,Morning folks! LA traffic to work  listening to Mario - Break up this goes sooo hard 2 me,Tue Apr 07 07:45:43 PDT 2009,English,83825,NO_QUERY,3477
3478,justin-hard time finding work me-hard time being happy ,Tue Apr 07 07:45:46 PDT 2009,English,101185,NO_QUERY,3478
3479,awesome. no voice again today. work is going to be impossible. ,Tue Apr 07 07:48:07 PDT 2009,English,109841,NO_QUERY,3479
3480,"Got home. A parcel that was meant for me was delivered to our neighbours' house, but they're not home... ",Tue Apr 07 07:48:09 PDT 2009,English,8604,NO_QUERY,3480
3481,"Did some voluneering and now have to focus on Uni stuff. Need to write a press release, how hard...  wish I had more practice",Tue Apr 07 07:48:09 PDT 2009,English,7532,NO_QUERY,3481
3482,"I just saw a video of Grown Man from Champaign,IL. I can tell Donnie's back is hurting him in it  His usual hip action is toned way down!",Tue Apr 07 07:48:10 PDT 2009,English,26432,NO_QUERY,3482
3483,Still sitting in class eating goldfish and drinking sprite! If only it was lunch time ,Tue Apr 07 07:48:12 PDT 2009,English,97040,NO_QUERY,3483
3484,@morningroc What about Robert Englund? ,Tue Apr 07 07:48:14 PDT 2009,English,82419,NO_QUERY,3484
3485,&quot;Pack&quot; the duckling found safe but his webbed feet have been cut and a new one will still have to be made.  http://is.gd/rdfK,Tue Apr 07 07:48:14 PDT 2009,English,88280,NO_QUERY,3485
3486,trying to find a good vet around here. i think one of my kitties has asthma ,Tue Apr 07 07:48:14 PDT 2009,English,3539,NO_QUERY,3486
3487,can't write anymore papers  five to go,Tue Apr 07 07:48:20 PDT 2009,English,112683,NO_QUERY,3487
3488,@kenbillups Mitchell James is my uncle (Kappa man who passed 4 yrs ago). The Kappas named a scholarship after him. Miss my superman ,Tue Apr 07 07:48:20 PDT 2009,English,30811,NO_QUERY,3488
3489,Happy opening day! Wish I could be getting ready to go to the Giants game instead of work ,Tue Apr 07 07:48:26 PDT 2009,English,103038,NO_QUERY,3489
3490,"yep, say hello to $1.29 #iTunes downloads, the #new #standard for #high-quality, #over-priced #digital #downloads. #Sad, sad day. ",Tue Apr 07 07:48:29 PDT 2009,English,72170,NO_QUERY,3490
3491,I love it when class gets cancelled! Too bad it's my 2nd of 3 classes of the day so I still have to stay for my 1st &amp; last ones ,Tue Apr 07 07:48:29 PDT 2009,English,37283,NO_QUERY,3491
3492,is hoping this tummy ache from too many cookies will go away soon. thanks brady  ,Tue Apr 07 07:48:30 PDT 2009,English,110976,NO_QUERY,3492
3493,Why doesn't high school teach apa style citation? Its all i'm supposed to use in my class ,Tue Apr 07 07:48:30 PDT 2009,English,51030,NO_QUERY,3493
3494,@OICUCHLOE We do talk else where &gt;&lt; I wasn't there ,Tue Apr 07 07:48:33 PDT 2009,English,73965,NO_QUERY,3494
3495,not impressed with the fact it is SNOWING APRIL 7TH ,Tue Apr 07 07:48:34 PDT 2009,English,104639,NO_QUERY,3495
3496,Last day @ Disney ,Tue Apr 07 07:48:37 PDT 2009,English,99633,NO_QUERY,3496
3497,Swamped at work....  not a good day      But trying to keep positive... The weekend is not THAT far.,Tue Apr 07 07:48:36 PDT 2009,English,51973,NO_QUERY,3497
3498,Come home to expect his warm hug &amp; gets none! ,Tue Apr 07 07:48:39 PDT 2009,English,36051,NO_QUERY,3498
3499,@BerlinByNight RUB IT IN! ,Tue Apr 07 07:48:39 PDT 2009,English,36220,NO_QUERY,3499
3500,The man behind me on the train smells so much of booze it's giving me a headache ,Tue Apr 07 07:48:39 PDT 2009,English,90879,NO_QUERY,3500
3501,Missed Jon's tweets again last Knight   He waits until I turn off my phone to start twittering!  Still love him though!  LOL!,Tue Apr 07 07:48:41 PDT 2009,English,26366,NO_QUERY,3501
3502,I'm fighting a losing battle with a broken heart. ,Tue Apr 07 07:48:44 PDT 2009,English,10810,NO_QUERY,3502
3503,"@TomFelton Oh Tom, my pancake hopes have fallen flat  Oops, there's that &quot;Draco Malfoy&quot; stare. Better get back to work.",Tue Apr 07 07:48:49 PDT 2009,English,15917,NO_QUERY,3503
3504,@victoriaellis I find that almost un iversally true ,Tue Apr 07 07:48:55 PDT 2009,English,14945,NO_QUERY,3504
3505,watching pokemon. WHERE IS EVERYONE ,Tue Apr 07 07:48:54 PDT 2009,English,84180,NO_QUERY,3505
3506,"@hilarymarie My kids asked about &quot;the red dots&quot; on my face, &quot;why like that? how come?&quot; Pimples. &quot;what are pimples?&quot; ",Tue Apr 07 07:48:56 PDT 2009,English,77777,NO_QUERY,3506
3507,http://twitpic.com/2yh5g - Today is the day. Gotta sell the scooter ,Tue Apr 07 07:48:58 PDT 2009,English,97401,NO_QUERY,3507
3508,Please no rain today! I got some things to do outside ,Tue Apr 07 07:49:00 PDT 2009,English,51983,NO_QUERY,3508
3509,I need friends for twitter ,Tue Apr 07 07:49:00 PDT 2009,English,114837,NO_QUERY,3509
3510,@FemaleProdigy Hate to burst your bubble but TV Guide's Matt Roush says it's a disaster!  I was looking fwd to it also. ,Tue Apr 07 07:49:04 PDT 2009,English,114536,NO_QUERY,3510
3511,just woke up  kinda not feeling well... http://plurk.com/p/n2obx,Tue Apr 07 07:49:07 PDT 2009,English,46261,NO_QUERY,3511
3512,i don't want to get out of bed ,Tue Apr 07 07:49:09 PDT 2009,English,32073,NO_QUERY,3512
3513,"@hayden_harnett Unfortunately, that's been happening since yesterday ",Tue Apr 07 07:49:09 PDT 2009,English,11254,NO_QUERY,3513
3514,is off 2 work ,Tue Apr 07 07:49:13 PDT 2009,English,100114,NO_QUERY,3514
3515,: staying away from tea all day today ,Tue Apr 07 07:49:12 PDT 2009,English,97628,NO_QUERY,3515
3516,"@LauraGuthrie Sadly not  Wet, grey and really quite yuck again. Any better over there?",Tue Apr 07 07:49:13 PDT 2009,English,25354,NO_QUERY,3516
3517,@juliekoh I've just discovered I'm busy around lunchtime  I don't suppose dinner is possible?,Tue Apr 07 07:49:14 PDT 2009,English,57372,NO_QUERY,3517
3518,@jenlar So not fair. Some of us are stuck at work...  I wanna be cozy at home!,Tue Apr 07 07:49:16 PDT 2009,English,23004,NO_QUERY,3518
3519,wasting time. ,Tue Apr 07 07:49:20 PDT 2009,English,109795,NO_QUERY,3519
3520,SIck and tired of hacking away at a third parties PHP code. The whole thing needs re-written so as to be maintainable. ,Tue Apr 07 07:49:22 PDT 2009,English,117734,NO_QUERY,3520
3521,@RobPattinson_ I can imagine the amount of messages you get everyday! I wish my job was exciting as yours! Enjoy everymoment of it for me ,Tue Apr 07 07:49:25 PDT 2009,English,43271,NO_QUERY,3521
3522,I can't believe that I am still waiting for a damn delivery. It's clearly not coming today. ,Tue Apr 07 07:49:28 PDT 2009,English,61488,NO_QUERY,3522
3523,i get to work again today and tomorrow! i'm so lucky... ,Tue Apr 07 07:49:28 PDT 2009,English,78186,NO_QUERY,3523
3524,@HeatherAnnP hearing you talk about editing pictures makes me cringe  lol,Tue Apr 07 07:49:28 PDT 2009,English,52,NO_QUERY,3524
3525,"eating, eating, eating................. ",Tue Apr 07 07:49:37 PDT 2009,English,105601,NO_QUERY,3525
3526,our grass is so high that I let the dog out and he comes back soaked all over! poor thing ,Tue Apr 07 07:49:40 PDT 2009,English,66323,NO_QUERY,3526
3527,I'm sad to hear the news of an 8-yr-old girl who has been missing in our area - her body was found last night - Prayers are needed ,Tue Apr 07 07:49:43 PDT 2009,English,92779,NO_QUERY,3527
3528,"@Zee It's good, but buggy like a motherfucker. ",Tue Apr 07 07:49:49 PDT 2009,English,102506,NO_QUERY,3528
3529,"this day is going from bad to worse...i broke my shoe this morning, it's windy and freezing cold out, and I still have to take a DE test. ",Tue Apr 07 07:49:57 PDT 2009,English,58402,NO_QUERY,3529
3530,i am sorry to hear about your grandma   anything i can do for you?,Tue Apr 07 07:49:58 PDT 2009,English,115199,NO_QUERY,3530
3531,@sfrancisk  my brain is mad too. but i don't imagine as mad as yours. *pat*,Tue Apr 07 07:50:03 PDT 2009,English,76581,NO_QUERY,3531
3532,@jessid33 I hope things start looking up soon  Coffee always helps me! ,Tue Apr 07 07:50:03 PDT 2009,English,29541,NO_QUERY,3532
3533,"Gots to go now Twitters, Have an MRI scan at 5.30pm  I HATE MRI's.",Tue Apr 07 07:50:04 PDT 2009,English,16871,NO_QUERY,3533
3534,Mmm...English is difficult ,Tue Apr 07 07:50:07 PDT 2009,English,73487,NO_QUERY,3534
3535,"@Super_Angel I was wondering if y'all were going to observe the passover, I'm sad our church is not doing it this year. ",Tue Apr 07 07:50:13 PDT 2009,English,79147,NO_QUERY,3535
3536,@CuddlyDragon Heading back home on Thursday evening after work I'm afraid. ,Tue Apr 07 07:50:14 PDT 2009,English,17701,NO_QUERY,3536
3537,"Omfg, days like these kill my soul. And it's not even lunchtime yet. ",Tue Apr 07 07:50:15 PDT 2009,English,219,NO_QUERY,3537
3538,sdafghjkl;jhgnfbdvsdfghjkj i hate things like this ,Tue Apr 07 07:50:19 PDT 2009,English,122011,NO_QUERY,3538
3539,my throat still hurts  Wah!! Feel sorry for me lol,Tue Apr 07 07:50:20 PDT 2009,English,110850,NO_QUERY,3539
3540,starting to worry about the java exam... ,Tue Apr 07 07:50:24 PDT 2009,English,120747,NO_QUERY,3540
3541,"Ugh...going to school, bye bye ",Tue Apr 07 07:50:26 PDT 2009,English,4935,NO_QUERY,3541
3542,@ciara_danella Carol! a gun was held to my head as i booked my flight. Ciara made me do it. I didnt have a choie  lol,Tue Apr 07 07:50:32 PDT 2009,English,105802,NO_QUERY,3542
3543,"sick today    staying home, and watching CHICAGO &lt;3",Tue Apr 07 07:50:32 PDT 2009,English,69731,NO_QUERY,3543
3544,Paypal is telling me to look at a guide for IPN.That guide tells me to look at another guide.The 2nd guide tells me to look at the first. ,Tue Apr 07 07:50:33 PDT 2009,English,94398,NO_QUERY,3544
3545,"2 young men with suit/tie at my door talking about God, Jesus... Took me 15 seconds to get rid of them. Poor guys... Completely lost... ",Tue Apr 07 07:50:33 PDT 2009,English,31760,NO_QUERY,3545
3546,Just invoked quicksilver.  Now i am over BumpTop Beta only beings Windows for now.  Poor Windows and no Quicksilver  ,Tue Apr 07 07:50:35 PDT 2009,English,83499,NO_QUERY,3546
3547,"@bird_e seen your cuz last night in traf, he was with my brother... he misses u ",Tue Apr 07 07:50:38 PDT 2009,English,109194,NO_QUERY,3547
3548,"online bankovnictv� KB je offline zrovna kdy� je to nejv�c pot?eba  �lak m? tref�, grrr",Tue Apr 07 07:50:38 PDT 2009,English,1154,NO_QUERY,3548
3549,I hate waking up in the morning with a sinus infection. It's the worst. ,Tue Apr 07 07:50:42 PDT 2009,English,53682,NO_QUERY,3549
3550,@flipmcneil lol slim goodbody?? I wanna see that pic! and for some reason I keep missing your @ replies to me ,Tue Apr 07 07:50:42 PDT 2009,English,24465,NO_QUERY,3550
3551,@TonyWade LOL I think twitter is just behind by 6 minutes or so!will check ur e mail shortly!on phone to insurance company ,Tue Apr 07 07:50:47 PDT 2009,English,12040,NO_QUERY,3551
3552,Am bored anyone want to talk to me??? ,Tue Apr 07 07:50:48 PDT 2009,English,16345,NO_QUERY,3552
3553,Had horrible dream in which one of The Sats died :|  The first dream I've had about them that I properly remember and it's that terrible!!,Tue Apr 07 07:50:49 PDT 2009,English,9889,NO_QUERY,3553
3554,miley and demi please reply ,Tue Apr 07 07:50:53 PDT 2009,English,59700,NO_QUERY,3554
3555,@KittyBradshaw I'm shocked I thought NYC was cock full of quality nail shops ,Tue Apr 07 07:52:54 PDT 2009,English,57770,NO_QUERY,3555
3556,does not enjoy being beaten on wii fit  GAME ON.,Tue Apr 07 07:53:00 PDT 2009,English,19577,NO_QUERY,3556
3557,"@kirsty_lee My battery life is about two hours; if I'm doing internets or have 2+ programs open, it'll die even faster! ",Tue Apr 07 07:53:07 PDT 2009,English,48503,NO_QUERY,3557
3558,@annietrevino    i miss you sooo much  come back to my home!,Tue Apr 07 07:53:06 PDT 2009,English,18248,NO_QUERY,3558
3559,had an interesting night to say the least ,Tue Apr 07 07:53:07 PDT 2009,English,122418,NO_QUERY,3559
3560,"Feeling very, very envious of everyone who has already seen Star Trek in Austin, TX and Australia. ",Tue Apr 07 07:53:09 PDT 2009,English,60492,NO_QUERY,3560
3561,"Not like I'm an important presence on Twitter, but I will probably not be updating from the Internet until after I get married; too busy. ",Tue Apr 07 07:53:11 PDT 2009,English,97011,NO_QUERY,3561
3562,"@ASacco almost, but still about 2 months short. I got mine Nov.21 and even with the annual upgrade I would still have to wait. ",Tue Apr 07 07:53:12 PDT 2009,English,8355,NO_QUERY,3562
3563,going to go sleep. i wish it was the weekend already! 2 more days of work to go! ,Tue Apr 07 07:53:14 PDT 2009,English,89343,NO_QUERY,3563
3564,working through a really bad headache! ,Tue Apr 07 07:53:17 PDT 2009,English,19207,NO_QUERY,3564
3565,"i hate SAT scores, i'm a mess ",Tue Apr 07 07:53:23 PDT 2009,English,24704,NO_QUERY,3565
3566,@dashkdot  Oh no!    Not to mention all the dust and yuck they'll inevitably stir up.  I'm so sorry.  Theoretically you get a better road?,Tue Apr 07 07:53:26 PDT 2009,English,104260,NO_QUERY,3566
3567,"@Dozc Not aching too bad this morning, just very tired  Cat not on any special diet, just going to feed the fat bastard less!!",Tue Apr 07 07:53:26 PDT 2009,English,64991,NO_QUERY,3567
3568,"okay this holiday i plan to. go shopping in birmingham, have a sleepover. urm, go down walsall. do more fun stuff ",Tue Apr 07 07:53:27 PDT 2009,English,88159,NO_QUERY,3568
3569,last day at work  im gonna miss it,Tue Apr 07 07:53:28 PDT 2009,English,47396,NO_QUERY,3569
3570,"@WackoTTL Man, I'm sorry to hear about that ",Tue Apr 07 07:53:28 PDT 2009,English,66312,NO_QUERY,3570
3571,i dislike dreams that make you feel sad even after you wake up ,Tue Apr 07 07:53:29 PDT 2009,English,114508,NO_QUERY,3571
3572,is in my education class.  Where did all the warm weather go?? ,Tue Apr 07 07:53:29 PDT 2009,English,109108,NO_QUERY,3572
3573,"Five minutes of sunshine to melt the snow, back to windy and gray again.  ",Tue Apr 07 07:53:35 PDT 2009,English,23648,NO_QUERY,3573
3574,a woman cannot survive on toast and cheesy wotsits alone ,Tue Apr 07 07:53:34 PDT 2009,English,12671,NO_QUERY,3574
3575,Gotta leave for work soon  Anyone fancy going for me?,Tue Apr 07 07:53:43 PDT 2009,English,38451,NO_QUERY,3575
3576,Just posting about my first time with the #WiiFit - It's okay...but not what I thought it was going to be  http://bit.ly/K6wwM,Tue Apr 07 07:53:44 PDT 2009,English,34940,NO_QUERY,3576
3577,@thedangles  no emobeans.,Tue Apr 07 07:53:45 PDT 2009,English,103895,NO_QUERY,3577
3578,Is in love with Slumdog Millionaire! Such a sweet movie made me sad ,Tue Apr 07 07:53:48 PDT 2009,English,2534,NO_QUERY,3578
3579,just finished a morning 4-miler...not too shabby although it looks like rain is coming   work time...,Tue Apr 07 07:53:50 PDT 2009,English,77265,NO_QUERY,3579
3580,I found a thorpe park brochure from 2004 whilst looking for a revision notebook. I'm jealous that annual passes used to be �80 ,Tue Apr 07 07:53:55 PDT 2009,English,111726,NO_QUERY,3580
3581,Out of pickles... ,Tue Apr 07 07:53:57 PDT 2009,English,31275,NO_QUERY,3581
3582,"@heykimmi our timing in the last days is bullshit x) And next week, you're in holidays   But I hope to see you soon (THE weekend)",Tue Apr 07 07:53:58 PDT 2009,English,107147,NO_QUERY,3582
3583,Pooooo!! Do i have to go to work today!! ,Tue Apr 07 07:54:04 PDT 2009,English,74357,NO_QUERY,3583
3584,hurt my toe trying to get to the phone ,Tue Apr 07 07:54:06 PDT 2009,English,104408,NO_QUERY,3584
3585,stupid cocking megavideo :@ wish wixi wasnt down today ,Tue Apr 07 07:54:08 PDT 2009,English,65720,NO_QUERY,3585
3586,"my first full week of class this week. no skipping, sad day ",Tue Apr 07 07:54:12 PDT 2009,English,78256,NO_QUERY,3586
3587,suuuhleepy in class. zombie for the day. essay kept me up last night ,Tue Apr 07 07:54:14 PDT 2009,English,51176,NO_QUERY,3587
3588,@robby1051 I know people who don't even use the straps. Makes me nervous ,Tue Apr 07 07:54:16 PDT 2009,English,13178,NO_QUERY,3588
3589,@KHill215 I seriously had hopes of wearing something short sleeved for Easter Sunday Service... Probably need a shawl or sweater! ,Tue Apr 07 07:54:18 PDT 2009,English,22718,NO_QUERY,3589
3590,is on the verge of somthing great......just not sure what it is . ,Tue Apr 07 07:54:24 PDT 2009,English,81643,NO_QUERY,3590
3591,"@ApplaudtheActor Oh no, definitely not a stranger to House. Just haven't watched last night's episode yet. Not looking forward to it now. ",Tue Apr 07 07:54:27 PDT 2009,English,40591,NO_QUERY,3591
3592,"and i am officially hungry again, it is going to be a long day today ",Tue Apr 07 07:54:29 PDT 2009,English,85286,NO_QUERY,3592
3593,Suggestion - any charity in Singapore need a (perfectly working) Netgear router? I lost the driver CD though ,Tue Apr 07 07:54:29 PDT 2009,English,12461,NO_QUERY,3593
